{
  "cloud": "AzureUSGovernment",
  "openAIAvailable": true,
  "cognitiveRegions": [
    "usgovarizona",
    "usgovvirginia"
  ],
  "cognitiveAvailable": true,
  "schemaVersion": "1.0.0",
  "openAIModelVersion": "2025-11-13",
  "imageGeneration": {
    "catalogQuerySucceeded": true,
    "available": false,
    "models": [],
    "selectedModelName": "",
    "selectedModelVersion": "",
    "selectedModelFormat": "",
    "selectedModelSku": "",
    "selectedProvider": "none",
    "selectedMaturity": "none",
    "requiresExplicitAcceptance": false,
    "quota": {
      "querySucceeded": false,
      "matchFound": false,
      "status": "unknown",
      "currentValue": null,
      "limit": null,
      "unit": ""
    },
    "existingDeployments": {
      "querySucceeded": true,
      "available": false,
      "count": 0,
      "regions": [],
      "models": [],
      "formats": []
    }
  },
  "discoveredAt": "2026-09-16T23:05:17.7138319Z",
  "location": "usgovvirginia",
  "openAIModelSku": "DataZoneStandard",
  "openAIModelName": "gpt-5.1",
  "speech": {
    "existingResourceQuerySucceeded": true,
    "existingResourceKinds": [
      "SpeechServices",
      "AIServices"
    ],
    "existingResourceCount": 2,
    "serviceAvailable": true,
    "serviceRegions": [
      "usgovarizona",
      "usgovvirginia"
    ],
    "existingResourceRegions": [
      "usgovarizona"
    ],
    "existingResourceAvailable": true
  },
  "openAIApiVersion": "2025-04-01-preview"
}
